{
  "packet_version": "1.0",
  "mode": "preflight-only",
  "status": "failure",
  "run_id": "RUN_ID_PLACEHOLDER",
  "timestamp_utc": "TIMESTAMP_PLACEHOLDER",
  "intent": "contract-preflight",
  "tool_name": "llama-throughput-lab",
  "receipt_path": null,
  "failure_summary": "preflight checks failed",
  "next_step": "Fix preflight failures before smoke.",
  "data": {
    "contract_version": "nexus-contract-v1"
  }
}
